{
  "description": "Sagittarius is the ninth sign of the zodiac and is known for its optimistic and adventurous nature. People born under this sign are often seen as being very philosophical and freedom-loving. They are known for their ability to see the bigger picture and seek truth.",
  "strengths": [
    "Optimistic",
    "Adventurous",
    "Philosophical"
  ],
  "weaknesses": [
    "Impatient",
    "Overly blunt",
    "Restless"
  ],
  "rising": {
    "description": "Sagittarius rising people often appear optimistic and adventurous. They have an enthusiastic presence and are known for their love of freedom and exploration."
  },
  "sun": {
    "description": "Sagittarius sun people are naturally optimistic and philosophical. They have a strong desire for freedom and often excel in roles that require vision and exploration.",
    "houses": {
      "1": {
        "description": "With Sagittarius sun in the first house, you have an optimistic, adventurous personality. You're known for your enthusiasm and love of freedom. Your physical appearance often reflects your energetic nature."
      },
      "2": {
        "description": "Sagittarius sun in the second house indicates an optimistic approach to finances and values. You're likely to spend money on travel and education. Your self-worth is tied to your freedom."
      },
      "3": {
        "description": "With Sagittarius sun in the third house, you communicate with enthusiasm. You have a philosophical approach to learning and often share knowledge with optimism. Your siblings may be adventurous or philosophical."
      },
      "4": {
        "description": "Sagittarius sun in the fourth house suggests an adventurous and free-spirited home environment. You may have had a diverse upbringing and often create spaces that reflect your love of travel."
      },
      "5": {
        "description": "With Sagittarius sun in the fifth house, you express your creativity through adventure. You're attracted to optimistic partners and may have children who are adventurous and philosophical."
      },
      "6": {
        "description": "Sagittarius sun in the sixth house indicates an optimistic approach to work and health. You're likely to be drawn to adventurous professions and need freedom in your daily routines."
      },
      "7": {
        "description": "With Sagittarius sun in the seventh house, you seek optimistic partnerships. You're attracted to adventurous partners and value freedom in relationships."
      },
      "8": {
        "description": "Sagittarius sun in the eighth house suggests an optimistic approach to shared resources and transformation. You're likely to be interested in philosophical healing and growth."
      },
      "9": {
        "description": "With Sagittarius sun in the ninth house, you approach higher learning and philosophy with enthusiasm. You're likely to be interested in diverse forms of spirituality."
      },
      "10": {
        "description": "Sagittarius sun in the tenth house indicates a career that involves adventure and philosophy. You're likely to excel in fields that require vision and exploration."
      },
      "11": {
        "description": "With Sagittarius sun in the eleventh house, you seek optimistic friendships. You're likely to be involved in groups that emphasize adventure and philosophy."
      },
      "12": {
        "description": "Sagittarius sun in the twelfth house suggests that your optimistic nature may be expressed in private or behind the scenes. You may need to learn to balance freedom with spiritual growth."
      }
    }
  },
  "moon": {
    "description": "Sagittarius moon people have a strong need for freedom and adventure. They process emotions through exploration and often have an optimistic emotional nature."
  }
} 